{
  "vocabularyId": "bfo-2020",
  "displayName": "Basic Formal Ontology 2020",
  "namespaceURI": "http://purl.obolibrary.org/obo/",
  "iriPattern": "^http://purl\\.obolibrary\\.org/obo/BFO_\\d{7}$",
  "version": "2020",
  "retrievedAt": null,
  "sourceURL": "http://purl.obolibrary.org/obo/bfo/2020/bfo.owl",
  "entries": [
    { "iri": "http://purl.obolibrary.org/obo/BFO_0000054", "type": "object-property", "label": "realized in", "unverified": true, "seedSource": "relations_catalogue_v3.tsv row 32" },
    { "iri": "http://purl.obolibrary.org/obo/BFO_0000055", "type": "object-property", "label": "realizes", "unverified": true, "seedSource": "relations_catalogue_v3.tsv row 31" },
    { "iri": "http://purl.obolibrary.org/obo/BFO_0000056", "type": "object-property", "label": "participates in", "unverified": true, "seedSource": "relations_catalogue_v3.tsv row 29" },
    { "iri": "http://purl.obolibrary.org/obo/BFO_0000057", "type": "object-property", "label": "has participant", "unverified": true, "seedSource": "relations_catalogue_v3.tsv row 30" },
    { "iri": "http://purl.obolibrary.org/obo/BFO_0000058", "type": "object-property", "label": "concretizes", "unverified": true, "seedSource": "relations_catalogue_v3.tsv row 38" },
    { "iri": "http://purl.obolibrary.org/obo/BFO_0000059", "type": "object-property", "label": "is concretized by", "unverified": true, "seedSource": "relations_catalogue_v3.tsv row 39" },
    { "iri": "http://purl.obolibrary.org/obo/BFO_0000062", "type": "object-property", "label": "preceded by", "unverified": true, "seedSource": "relations_catalogue_v3.tsv row 47" },
    { "iri": "http://purl.obolibrary.org/obo/BFO_0000063", "type": "object-property", "label": "precedes", "unverified": true, "seedSource": "relations_catalogue_v3.tsv row 46" },
    { "iri": "http://purl.obolibrary.org/obo/BFO_0000066", "type": "object-property", "label": "occurs in", "unverified": true, "seedSource": "relations_catalogue_v3.tsv row 40" },
    { "iri": "http://purl.obolibrary.org/obo/BFO_0000067", "type": "object-property", "label": "site of", "unverified": true, "seedSource": "relations_catalogue_v3.tsv row 41" },
    { "iri": "http://purl.obolibrary.org/obo/BFO_0000084", "type": "object-property", "label": "specifically depends on", "unverified": true, "seedSource": "relations_catalogue_v3.tsv row 35" },
    { "iri": "http://purl.obolibrary.org/obo/BFO_0000101", "type": "object-property", "label": "generically depends on", "unverified": true, "seedSource": "relations_catalogue_v3.tsv row 37" },
    { "iri": "http://purl.obolibrary.org/obo/BFO_0000108", "type": "object-property", "label": "exists at", "unverified": true, "seedSource": "relations_catalogue_v3.tsv row 48" },
    { "iri": "http://purl.obolibrary.org/obo/BFO_0000115", "type": "object-property", "label": "has member part", "unverified": true, "seedSource": "relations_catalogue_v3.tsv row 23" },
    { "iri": "http://purl.obolibrary.org/obo/BFO_0000117", "type": "object-property", "label": "has occurrent part", "unverified": true, "seedSource": "relations_catalogue_v3.tsv row 19" },
    { "iri": "http://purl.obolibrary.org/obo/BFO_0000129", "type": "object-property", "label": "member part of", "unverified": true, "seedSource": "relations_catalogue_v3.tsv row 22" },
    { "iri": "http://purl.obolibrary.org/obo/BFO_0000132", "type": "object-property", "label": "occurrent part of", "unverified": true, "seedSource": "relations_catalogue_v3.tsv row 18" },
    { "iri": "http://purl.obolibrary.org/obo/BFO_0000176", "type": "object-property", "label": "continuant part of", "unverified": true, "seedSource": "relations_catalogue_v3.tsv row 16" },
    { "iri": "http://purl.obolibrary.org/obo/BFO_0000178", "type": "object-property", "label": "has continuant part", "unverified": true, "seedSource": "relations_catalogue_v3.tsv row 17" },
    { "iri": "http://purl.obolibrary.org/obo/BFO_0000183", "type": "object-property", "label": "environs", "unverified": true, "seedSource": "relations_catalogue_v3.tsv row 44" },
    { "iri": "http://purl.obolibrary.org/obo/BFO_0000184", "type": "object-property", "label": "environed by", "unverified": true, "seedSource": "relations_catalogue_v3.tsv row 45" },
    { "iri": "http://purl.obolibrary.org/obo/BFO_0000195", "type": "object-property", "label": "specifically depended on by", "unverified": true, "seedSource": "relations_catalogue_v3.tsv row 36" },
    { "iri": "http://purl.obolibrary.org/obo/BFO_0000196", "type": "object-property", "label": "bearer of", "unverified": true, "seedSource": "relations_catalogue_v3.tsv row 34" },
    { "iri": "http://purl.obolibrary.org/obo/BFO_0000197", "type": "object-property", "label": "inheres in", "unverified": true, "seedSource": "relations_catalogue_v3.tsv row 33" },
    { "iri": "http://purl.obolibrary.org/obo/BFO_0000199", "type": "object-property", "label": "occupies temporal region", "unverified": true, "seedSource": "relations_catalogue_v3.tsv row 43" },
    { "iri": "http://purl.obolibrary.org/obo/BFO_0000200", "type": "object-property", "label": "occupies spatial region", "unverified": true, "seedSource": "relations_catalogue_v3.tsv row 42" },
    { "iri": "http://purl.obolibrary.org/obo/BFO_0000218", "type": "object-property", "label": "has temporal part", "unverified": true, "seedSource": "relations_catalogue_v3.tsv row 21" },
    { "iri": "http://purl.obolibrary.org/obo/BFO_0000219", "type": "object-property", "label": "temporal part of", "unverified": true, "seedSource": "relations_catalogue_v3.tsv row 20" },
    { "iri": "http://purl.obolibrary.org/obo/BFO_0000222", "type": "object-property", "label": "first instant of", "unverified": true, "seedSource": "relations_catalogue_v3.tsv row 49 — flagged [VERIFY] in catalogue; resolve against canonical bfo-2020.owl release pre-Phase-4" },
    { "iri": "http://purl.obolibrary.org/obo/BFO_0000223", "type": "object-property", "label": "last instant of", "unverified": true, "seedSource": "relations_catalogue_v3.tsv row 50 — flagged [VERIFY] in catalogue; resolve against canonical bfo-2020.owl release pre-Phase-4" },
    { "iri": "http://purl.obolibrary.org/obo/BFO_0000050", "type": "object-property", "label": "part of", "unverified": true, "seedSource": "relations_catalogue_v3.tsv row 14" },
    { "iri": "http://purl.obolibrary.org/obo/BFO_0000051", "type": "object-property", "label": "has part", "unverified": true, "seedSource": "relations_catalogue_v3.tsv row 15" }
  ]
}
